{
  "outcome": "fail",
  "confidence": "Certain",
  "findings": [
    {
      "check": "A-SEC-6",
      "title": "Passwords use a fast unsalted SHA-256 hash",
      "severity": "Critical",
      "path": "src/passwords.js",
      "line": 6,
      "quote": "  return createHash('sha256').update(password).digest('hex');"
    },
    {
      "check": "A-SEC-6",
      "title": "Password verification does not use constant-time comparison",
      "severity": "High",
      "path": "src/passwords.js",
      "line": 10,
      "quote": "  return hashPassword(password) === encoded;"
    },
    {
      "check": "A-SEC-6",
      "title": "Reset tokens are checked for prior use but never consumed",
      "severity": "High",
      "path": "src/reset.js",
      "line": 15,
      "quote": "function verifyResetToken(record, supplied) {"
    }
  ],
  "reasoning": "The repository fails because password storage uses unsalted SHA-256 rather than an approved password KDF, and password verification uses direct equality. Reset-token generation uses CSPRNG and reset-token comparison is constant time, but verification does not mark a valid token as used, so single use is not established. The reset route is rate-limited before registration and returns a generic response. No login, MFA verification, or development bypass route is present."
}
