{
  "outcome": "fail",
  "confidence": "Certain",
  "findings": [
    {
      "check": "A-SEC-6",
      "title": "Development environment bypass accepts every password",
      "severity": "High",
      "path": "src/passwords.js",
      "line": 10,
      "quote": "if (process.env.NODE_ENV === 'development') return true;"
    },
    {
      "check": "A-SEC-6",
      "title": "Reset token verification does not consume the token",
      "severity": "High",
      "path": "src/reset.js",
      "line": 19,
      "quote": "return expected.length === actual.length && timingSafeEqual(expected, actual);"
    }
  ],
  "reasoning": "bcrypt uses cost 12, reset tokens are generated with randomBytes(32), reset-token comparison is constant-time, the limiter is mounted before the reset route, and the reset response is generic. However, password verification has an environment-based bypass, and successful reset-token verification never marks the record as used, so the token can be reused."
}
